{
  "schema_version": "1.0.0",
  "slug": "safe-mode",
  "package_version": "1.1.0",
  "cases": [
    {
      "id": "safe-mode-positive-activation",
      "type": "positive_activation",
      "execution": "model-required",
      "given": "File changes and remote publication require exact state, credentials, and validation.",
      "expect": "Applies only planned changes, verifies tests and diff, confirms remote target and visibility, publishes, and checks the public URL. Result: A grounded public release or a precise fail-closed blocker.",
      "reject": "Omitting the mechanism or instead doing this: Invent credentials, redesign the repository during push, or claim publication before remote verification."
    },
    {
      "id": "safe-mode-negative-activation",
      "type": "negative_activation",
      "execution": "model-required",
      "given": "the primary need is broad architecture discovery",
      "expect": "Remain inactive; do not begin the package-specific first step: Declare SAFE and load the committed plan, authoritative state, permitted delta, and risk controls.",
      "reject": "Activating SAFE Mode solely because its name appears relevant"
    },
    {
      "id": "safe-mode-precedence-or-conflict",
      "type": "precedence_or_conflict",
      "execution": "model-required",
      "given": "A missing required source, permission, or checkpoint blocks execution.",
      "expect": "Honor the conflict rule and preserve this invariant: lock state and scope",
      "reject": "Silently violating the stated precedence for SAFE Mode"
    },
    {
      "id": "safe-mode-failure-boundary",
      "type": "failure_boundary",
      "execution": "model-required",
      "given": "speculative execution",
      "expect": "Stop, narrow, abstain, or escalate while preserving: scope and state lock",
      "reject": "Claiming a successful SAFE Mode result past this boundary"
    },
    {
      "id": "safe-mode-strong-model-scaling",
      "type": "strong_model_scaling",
      "execution": "model-required",
      "given": "a capable host can compress the workflow",
      "expect": "scope and state lock",
      "reject": "dropping the mandatory invariant"
    },
    {
      "id": "safe-mode-distinctive-mechanism",
      "type": "distinctive_mechanism",
      "execution": "model-required",
      "given": "A plan is selected and consequential execution must begin.",
      "expect": "The skill locks state and permitted delta, verifies prerequisites, executes atomically, checks results, and fails closed.",
      "reject": "The skill broadens alternatives like POWER, treats conservative as shallow, or continues on missing evidence."
    }
  ]
}
