{
  "schema_version": "1.0.0",
  "slug": "power-mode",
  "package_version": "1.1.0",
  "cases": [
    {
      "id": "power-mode-positive-activation",
      "type": "positive_activation",
      "execution": "model-required",
      "given": "Central, federated, and open-PR models create different trust and scaling behavior.",
      "expect": "Builds three architectures, evaluates governance and failure modes at system scale, selects one, and packages it for SAFE implementation. Result: A deeply compared architecture with a bounded execution handoff.",
      "reject": "Omitting the mechanism or instead doing this: Create repository settings or publish before the chosen design is validated."
    },
    {
      "id": "power-mode-negative-activation",
      "type": "negative_activation",
      "execution": "model-required",
      "given": "the task is a precise grounded execution step",
      "expect": "Remain inactive; do not begin the package-specific first step: Declare POWER, the design question, non-negotiable constraints, and exploration budget.",
      "reject": "Activating POWER Mode solely because its name appears relevant"
    },
    {
      "id": "power-mode-precedence-or-conflict",
      "type": "precedence_or_conflict",
      "execution": "model-required",
      "given": "Hard constraints and vetoes apply equally in broad exploration.",
      "expect": "Honor the conflict rule and preserve this invariant: bound exploration",
      "reject": "Silently violating the stated precedence for POWER Mode"
    },
    {
      "id": "power-mode-failure-boundary",
      "type": "failure_boundary",
      "execution": "model-required",
      "given": "unbounded ideation",
      "expect": "Stop, narrow, abstain, or escalate while preserving: bounded alternatives",
      "reject": "Claiming a successful POWER Mode result past this boundary"
    },
    {
      "id": "power-mode-strong-model-scaling",
      "type": "strong_model_scaling",
      "execution": "model-required",
      "given": "a capable host can compress the workflow",
      "expect": "bounded alternatives",
      "reject": "dropping the mandatory invariant"
    },
    {
      "id": "power-mode-distinctive-mechanism",
      "type": "distinctive_mechanism",
      "execution": "model-required",
      "given": "An ambiguous system design has several credible architectures.",
      "expect": "The skill enters a declared bounded broad-planning mode, compares architectures with QMS, collapses, and stops before consequential execution.",
      "reject": "The skill executes immediately, explores without bounds, or behaves like conservative SAFE validation."
    }
  ]
}
