{
  "schema_version": "1.0.0",
  "slug": "external-state-automation",
  "package_version": "1.1.0",
  "cases": [
    {
      "id": "external-state-automation-positive-activation",
      "type": "positive_activation",
      "execution": "model-required",
      "given": "Verified decisions and source pointers need durable continuation.",
      "expect": "Writes the compact snapshot to an authorized file, verifies it, and validates it on resume. Result: The next session restores traceable state or receives an explicit failure/staleness warning.",
      "reject": "Omitting the mechanism or instead doing this: Does not claim persistence before the write succeeds or store the whole conversation by default."
    },
    {
      "id": "external-state-automation-negative-activation",
      "type": "negative_activation",
      "execution": "model-required",
      "given": "the task ends in one session and needs no continuation",
      "expect": "Remain inactive; do not begin the package-specific first step: Confirm an authorized storage mechanism, location, lifetime, and data policy.",
      "reject": "Activating External State Automation solely because its name appears relevant"
    },
    {
      "id": "external-state-automation-precedence-or-conflict",
      "type": "precedence_or_conflict",
      "execution": "model-required",
      "given": "Host, system, domain, and explicit user authority take precedence over this component.",
      "expect": "Honor the conflict rule and preserve this invariant: Preserve the defining invariant: capability declaration, minimum-state serialization, write verification, and restore validation.",
      "reject": "Silently violating the stated precedence for External State Automation"
    },
    {
      "id": "external-state-automation-failure-boundary",
      "type": "failure_boundary",
      "execution": "model-required",
      "given": "no authorized storage capability is available",
      "expect": "Stop, narrow, abstain, or escalate while preserving: capability declaration, minimum-state serialization, write verification, and restore validation",
      "reject": "Claiming a successful External State Automation result past this boundary"
    },
    {
      "id": "external-state-automation-strong-model-scaling",
      "type": "strong_model_scaling",
      "execution": "model-required",
      "given": "a capable host can compress the workflow",
      "expect": "capability declaration, minimum-state serialization, write verification, and restore validation",
      "reject": "dropping the mandatory invariant"
    },
    {
      "id": "external-state-automation-distinctive-mechanism",
      "type": "distinctive_mechanism",
      "execution": "model-required",
      "given": "a task must continue across sessions using an actual storage system",
      "expect": "state is minimally serialized, written, verified, restored, and reconciled",
      "reject": "claiming memory without a real write or storing unbounded conversation data"
    }
  ]
}
