{
  "schema_version": "1.0.0",
  "slug": "explanation-minimality-scaffold",
  "package_version": "1.1.0",
  "cases": [
    {
      "id": "explanation-minimality-scaffold-positive-activation",
      "type": "positive_activation",
      "execution": "model-required",
      "given": "The user needs outcome, material changes, validation, and next step—not a narration of every command.",
      "expect": "A compact handoff that remains trustworthy and actionable.",
      "reject": "remaining inactive despite a satisfied trigger"
    },
    {
      "id": "explanation-minimality-scaffold-negative-activation",
      "type": "negative_activation",
      "execution": "model-required",
      "given": "the user requests a tutorial or exhaustive rationale",
      "expect": "the component stays inactive and adds no scaffolding",
      "reject": "activating solely because the name appears relevant"
    },
    {
      "id": "explanation-minimality-scaffold-precedence-or-conflict",
      "type": "precedence_or_conflict",
      "execution": "model-required",
      "given": "User-requested detail and risk-mandated disclosure override brevity.",
      "expect": "the higher-authority rule wins and the conflict is visible",
      "reject": "silently resolving against higher authority"
    },
    {
      "id": "explanation-minimality-scaffold-failure-boundary",
      "type": "failure_boundary",
      "execution": "model-required",
      "given": "terse but unactionable output",
      "expect": "the component stops, abstains, narrows, or escalates as documented",
      "reject": "manufacturing a successful result past its failure boundary"
    },
    {
      "id": "explanation-minimality-scaffold-strong-model-scaling",
      "type": "strong_model_scaling",
      "execution": "model-required",
      "given": "a capable host can compress the workflow",
      "expect": "reader-and-risk calibration",
      "reject": "dropping the mandatory invariant"
    },
    {
      "id": "explanation-minimality-scaffold-distinctive-mechanism",
      "type": "distinctive_mechanism",
      "execution": "model-required",
      "given": "A correct answer contains background, repeated conclusions, a necessary caveat, and one causal bridge.",
      "expect": "The skill deletes background and repetition while retaining the bridge and caveat.",
      "reject": "The skill simply applies a word limit, drops all reasoning, or claims a recovered historical algorithm."
    }
  ]
}
