{
  "schema_version": "1.0.0",
  "slug": "image-text-fidelity-capture",
  "package_version": "1.1.0",
  "cases": [
    {
      "id": "image-text-fidelity-capture-positive-activation",
      "type": "positive_activation",
      "execution": "model-required",
      "given": "Text must be captured from an image for evidence use.",
      "expect": "Transcribes legible digits, preserves row order, and marks the obscured digits with their location. Result: A usable transcription whose uncertainty remains auditable.",
      "reject": "Omitting the mechanism or instead doing this: Infer the missing digits from another identifier."
    },
    {
      "id": "image-text-fidelity-capture-negative-activation",
      "type": "negative_activation",
      "execution": "model-required",
      "given": "no image contains source text or visible structure",
      "expect": "Remain inactive; do not begin the package-specific first step: Record the image/page identifier and reading order.",
      "reject": "Activating Image Text Fidelity Capture solely because its name appears relevant"
    },
    {
      "id": "image-text-fidelity-capture-precedence-or-conflict",
      "type": "precedence_or_conflict",
      "execution": "model-required",
      "given": "Visible evidence outranks grammatical completion.",
      "expect": "Honor the conflict rule and preserve this invariant: Preserve visible spelling, numbers, labels, and structure.",
      "reject": "Silently violating the stated precedence for Image Text Fidelity Capture"
    },
    {
      "id": "image-text-fidelity-capture-failure-boundary",
      "type": "failure_boundary",
      "execution": "model-required",
      "given": "If a region is not legible enough to verify, mark it uncertain and do not produce a confident transcription for that region.",
      "expect": "Stop, narrow, abstain, or escalate while preserving: only visible evidence may determine captured text or structure",
      "reject": "Claiming a successful Image Text Fidelity Capture result past this boundary"
    },
    {
      "id": "image-text-fidelity-capture-strong-model-scaling",
      "type": "strong_model_scaling",
      "execution": "model-required",
      "given": "a capable host can compress the workflow",
      "expect": "only visible evidence may determine captured text or structure",
      "reject": "dropping the mandatory invariant"
    },
    {
      "id": "image-text-fidelity-capture-distinctive-mechanism",
      "type": "distinctive_mechanism",
      "execution": "model-required",
      "given": "An image shows 'A12?7' with one obscured character while context suggests 'A1237'.",
      "expect": "Return an uncertainty marker for the obscured character.",
      "reject": "A confident transcription of A1237 based on context."
    }
  ]
}
