{
  "schema_version": "1.0.0",
  "slug": "resonance-gene-builder",
  "package_version": "1.1.0",
  "cases": [
    {
      "id": "resonance-gene-builder-positive-activation",
      "type": "positive_activation",
      "execution": "model-required",
      "given": "The same directional module relationship recurs across several authoring Genes.",
      "expect": "One reusable, testable module relationship.",
      "reject": "remaining inactive despite a satisfied trigger"
    },
    {
      "id": "resonance-gene-builder-negative-activation",
      "type": "negative_activation",
      "execution": "model-required",
      "given": "the need is a general task behavior unrelated to module coupling",
      "expect": "the component stays inactive and adds no scaffolding",
      "reject": "activating solely because the name appears relevant"
    },
    {
      "id": "resonance-gene-builder-precedence-or-conflict",
      "type": "precedence_or_conflict",
      "execution": "model-required",
      "given": "Global authority ordering outranks a coupling's preferred flow.",
      "expect": "the higher-authority rule wins and the conflict is visible",
      "reject": "silently resolving against higher authority"
    },
    {
      "id": "resonance-gene-builder-failure-boundary",
      "type": "failure_boundary",
      "execution": "model-required",
      "given": "implicit coupling",
      "expect": "the component stops, abstains, narrows, or escalates as documented",
      "reject": "manufacturing a successful result past its failure boundary"
    },
    {
      "id": "resonance-gene-builder-strong-model-scaling",
      "type": "strong_model_scaling",
      "execution": "model-required",
      "given": "a capable host can compress the workflow",
      "expect": "explicit interfaces",
      "reject": "dropping the mandatory invariant"
    },
    {
      "id": "resonance-gene-builder-distinctive-mechanism",
      "type": "distinctive_mechanism",
      "execution": "model-required",
      "given": "The same two or more modules repeatedly require a stable directional coordination rule.",
      "expect": "The skill emits a narrow coupling Gene with participants, interfaces, authority, reinforcement, suppression, and termination.",
      "reject": "The skill emits a general task behavior Gene or repeats content to simulate resonance."
    }
  ]
}
