{
  "schema_version": "1.0.0",
  "slug": "counterfactual-silence-scaffold",
  "package_version": "1.1.0",
  "cases": [
    {
      "id": "counterfactual-silence-scaffold-positive-activation",
      "type": "positive_activation",
      "execution": "model-required",
      "given": "The output must remain factual and the missing cause invites speculation.",
      "expect": "Reports the chronology and marks cause as undetermined. Result: A factual summary with an explicit evidence gap.",
      "reject": "Omitting the mechanism or instead doing this: Add what might have happened if a different operator acted."
    },
    {
      "id": "counterfactual-silence-scaffold-negative-activation",
      "type": "negative_activation",
      "execution": "model-required",
      "given": "the task explicitly requests scenarios, hypotheses, or counterfactual analysis",
      "expect": "Remain inactive; do not begin the package-specific first step: Confirm that the task contract excludes hypothetical reasoning.",
      "reject": "Activating Counterfactual Silence Scaffold solely because its name appears relevant"
    },
    {
      "id": "counterfactual-silence-scaffold-precedence-or-conflict",
      "type": "precedence_or_conflict",
      "execution": "model-required",
      "given": "An explicit user request for counterfactual analysis deactivates this scaffold and activates counterfactual integrity instead.",
      "expect": "Honor the conflict rule and preserve this invariant: Tie activation to an explicit factual-only boundary.",
      "reject": "Silently violating the stated precedence for Counterfactual Silence Scaffold"
    },
    {
      "id": "counterfactual-silence-scaffold-failure-boundary",
      "type": "failure_boundary",
      "execution": "model-required",
      "given": "If factual and counterfactual propositions cannot be distinguished reliably, request review rather than deleting uncertain content wholesale.",
      "expect": "Stop, narrow, abstain, or escalate while preserving: unauthorized hypothetical premises must not enter factual output",
      "reject": "Claiming a successful Counterfactual Silence Scaffold result past this boundary"
    },
    {
      "id": "counterfactual-silence-scaffold-strong-model-scaling",
      "type": "strong_model_scaling",
      "execution": "model-required",
      "given": "a capable host can compress the workflow",
      "expect": "unauthorized hypothetical premises must not enter factual output",
      "reject": "dropping the mandatory invariant"
    },
    {
      "id": "counterfactual-silence-scaffold-distinctive-mechanism",
      "type": "distinctive_mechanism",
      "execution": "model-required",
      "given": "A factual extraction draft adds an unsupported what-if explanation for a missing event.",
      "expect": "Remove the imagined explanation while retaining the documented gap.",
      "reject": "Suppressing a source quotation merely because the quotation contains hypothetical language."
    }
  ]
}
