{
  "schema_version": "1.0.0",
  "slug": "multi-truth-gating",
  "package_version": "1.1.0",
  "cases": [
    {
      "id": "multi-truth-gating-positive-activation",
      "type": "positive_activation",
      "execution": "model-required",
      "given": "The recommendation is consequential and one reasoning path may be fragile.",
      "expect": "Compares independent support and narrows the recommendation if causal support diverges. Result: A committed or bounded recommendation with its support status.",
      "reject": "Omitting the mechanism or instead doing this: Treat repeated citations to the same study as multiple truths."
    },
    {
      "id": "multi-truth-gating-negative-activation",
      "type": "negative_activation",
      "execution": "model-required",
      "given": "the claim is low consequence and one authoritative direct source is sufficient",
      "expect": "Remain inactive; do not begin the package-specific first step: Identify conclusions whose failure would materially change the outcome.",
      "reject": "Activating Multi-Truth Gating solely because its name appears relevant"
    },
    {
      "id": "multi-truth-gating-precedence-or-conflict",
      "type": "precedence_or_conflict",
      "execution": "model-required",
      "given": "A higher-authority direct source can outweigh a weaker corroborating path, but the disagreement must be recorded.",
      "expect": "Honor the conflict rule and preserve this invariant: Test anchor independence.",
      "reject": "Silently violating the stated precedence for Multi-Truth Gating"
    },
    {
      "id": "multi-truth-gating-failure-boundary",
      "type": "failure_boundary",
      "execution": "model-required",
      "given": "If an important conclusion lacks an independent check or the anchors materially disagree without resolution, do not certify the conclusion.",
      "expect": "Stop, narrow, abstain, or escalate while preserving: decision-critical claims require genuinely independent support or an explicit unresolved status",
      "reject": "Claiming a successful Multi-Truth Gating result past this boundary"
    },
    {
      "id": "multi-truth-gating-strong-model-scaling",
      "type": "strong_model_scaling",
      "execution": "model-required",
      "given": "a capable host can compress the workflow",
      "expect": "decision-critical claims require genuinely independent support or an explicit unresolved status",
      "reject": "dropping the mandatory invariant"
    },
    {
      "id": "multi-truth-gating-distinctive-mechanism",
      "type": "distinctive_mechanism",
      "execution": "model-required",
      "given": "Two apparent anchors derive from the same unsupported source.",
      "expect": "Reject independence and withhold multi-truth certification.",
      "reject": "Pass merely because two documents repeat the claim."
    }
  ]
}
