{
  "schema_version": "1.0.0",
  "slug": "attention-compression-scaffold",
  "package_version": "1.1.0",
  "cases": [
    {
      "id": "attention-compression-scaffold-positive-activation",
      "type": "positive_activation",
      "execution": "model-required",
      "given": "Full repository context exceeds the active workspace.",
      "expect": "Keeps exact signatures and errors, summarizes surrounding behavior with file pointers, and retires unrelated modules. Result: A compact debug context that can be expanded back to authoritative files.",
      "reject": "Omitting the mechanism or instead doing this: It does not rewrite signatures, discard conflicting traces, or pretend summaries are source files."
    },
    {
      "id": "attention-compression-scaffold-negative-activation",
      "type": "negative_activation",
      "execution": "model-required",
      "given": "the original context is already small",
      "expect": "Remain inactive; do not begin the package-specific first step: Define the current subtask and protected atoms that compression must preserve.",
      "reject": "Activating Attention Compression Scaffold solely because its name appears relevant"
    },
    {
      "id": "attention-compression-scaffold-precedence-or-conflict",
      "type": "precedence_or_conflict",
      "execution": "model-required",
      "given": "Zero-drift and source-fidelity requirements override compression goals.",
      "expect": "Honor the conflict rule and preserve this invariant: Preserve exact literals that cannot tolerate paraphrase.",
      "reject": "Silently violating the stated precedence for Attention Compression Scaffold"
    },
    {
      "id": "attention-compression-scaffold-failure-boundary",
      "type": "failure_boundary",
      "execution": "model-required",
      "given": "Do not activate the compressed view when a protected fact, conflict, or provenance link is lost or unverifiable.",
      "expect": "Stop, narrow, abstain, or escalate while preserving: protected-atom preservation",
      "reject": "Claiming a successful Attention Compression Scaffold result past this boundary"
    },
    {
      "id": "attention-compression-scaffold-strong-model-scaling",
      "type": "strong_model_scaling",
      "execution": "model-required",
      "given": "a capable host can compress the workflow",
      "expect": "protected-atom preservation",
      "reject": "dropping the mandatory invariant"
    },
    {
      "id": "attention-compression-scaffold-distinctive-mechanism",
      "type": "distinctive_mechanism",
      "execution": "model-required",
      "given": "A large corpus containing an exact number, an unresolved contradiction, and source locations.",
      "expect": "Preserve the number verbatim, retain the contradiction, and attach reload pointers in a smaller view.",
      "reject": "Smooth away the contradiction or lose the exact number/source link."
    }
  ]
}
